{
  "schemaVersion": 1,
  "protocolVersion": 1,
  "referenceTime": 1788000000,
  "configuredPairingCode": "TEST-CODE-0001",
  "vectors": [
    {
      "id": "SM-001",
      "description": "Status probe refreshes liveness and replies with the same event ID without hardware actions",
      "initialState": {
        "localPlatform": "mac",
        "coordinationEnabled": true,
        "usbAutomationEnabled": true,
        "usbPresent": false,
        "peerReachable": false,
        "peerLastSeenAtMs": null,
        "incomingEventID": null,
        "outgoingEventID": null,
        "newestIncomingRequestTimestamp": null,
        "seenMessages": [],
        "nextEventIDs": []
      },
      "steps": [
        {
          "atMs": 0,
          "input": {
            "kind": "receiveMessage",
            "message": {
              "version": 1,
              "type": "status_probe",
              "eventID": "10000000-0000-4000-8000-000000000001",
              "source": "windows",
              "target": "mac",
              "timestamp": 1788000000,
              "pairingCode": "TEST-CODE-0001"
            }
          }
        }
      ],
      "expectedActions": [
        { "atMs": 0, "kind": "acceptMessage", "type": "status_probe", "eventID": "10000000-0000-4000-8000-000000000001" },
        { "atMs": 0, "kind": "setPeerReachable", "value": true },
        { "atMs": 0, "kind": "sendMessage", "type": "status_response", "eventID": "10000000-0000-4000-8000-000000000001" }
      ],
      "expectedHardwareCalls": { "wake": 0, "switchDisplay": 0, "usbActions": 0 },
      "finalState": {
        "coordinationEnabled": true,
        "usbPresent": false,
        "peerReachable": true,
        "peerLastSeenAtMs": 0,
        "incomingEventID": null,
        "outgoingEventID": null
      }
    },
    {
      "id": "SM-002",
      "description": "Offline peer causes one request and immediate switch after USB debounce",
      "initialState": {
        "localPlatform": "mac",
        "coordinationEnabled": true,
        "usbAutomationEnabled": true,
        "usbPresent": true,
        "peerReachable": false,
        "peerLastSeenAtMs": null,
        "incomingEventID": null,
        "outgoingEventID": null,
        "newestIncomingRequestTimestamp": null,
        "seenMessages": [],
        "nextEventIDs": ["20000000-0000-4000-8000-000000000001"]
      },
      "steps": [
        { "atMs": 0, "input": { "kind": "usbPresenceChanged", "present": false } },
        { "atMs": 151, "input": { "kind": "switchCompleted", "eventID": "20000000-0000-4000-8000-000000000001", "success": true } }
      ],
      "expectedActions": [
        { "atMs": 150, "kind": "sendMessage", "type": "handover_request", "eventID": "20000000-0000-4000-8000-000000000001" },
        { "atMs": 150, "kind": "requestSwitch", "eventID": "20000000-0000-4000-8000-000000000001" },
        { "atMs": 151, "kind": "sendMessage", "type": "committed", "eventID": "20000000-0000-4000-8000-000000000001", "wakeSucceeded": true }
      ],
      "expectedHardwareCalls": { "wake": 0, "switchDisplay": 1, "usbActions": 0 },
      "finalState": {
        "coordinationEnabled": true,
        "usbPresent": false,
        "peerReachable": false,
        "peerLastSeenAtMs": null,
        "incomingEventID": null,
        "outgoingEventID": null
      }
    },
    {
      "id": "SM-003",
      "description": "Online peer receives four requests and falls back once at six hundred milliseconds after handover starts",
      "initialState": {
        "localPlatform": "windows",
        "coordinationEnabled": true,
        "usbAutomationEnabled": true,
        "usbPresent": true,
        "peerReachable": true,
        "peerLastSeenAtMs": -1000,
        "incomingEventID": null,
        "outgoingEventID": null,
        "newestIncomingRequestTimestamp": null,
        "seenMessages": [],
        "nextEventIDs": ["30000000-0000-4000-8000-000000000001"]
      },
      "steps": [
        { "atMs": 0, "input": { "kind": "usbPresenceChanged", "present": false } },
        { "atMs": 751, "input": { "kind": "switchCompleted", "eventID": "30000000-0000-4000-8000-000000000001", "success": false } }
      ],
      "expectedActions": [
        { "atMs": 150, "kind": "sendMessage", "type": "handover_request", "eventID": "30000000-0000-4000-8000-000000000001" },
        { "atMs": 300, "kind": "sendMessage", "type": "handover_request", "eventID": "30000000-0000-4000-8000-000000000001" },
        { "atMs": 450, "kind": "sendMessage", "type": "handover_request", "eventID": "30000000-0000-4000-8000-000000000001" },
        { "atMs": 600, "kind": "sendMessage", "type": "handover_request", "eventID": "30000000-0000-4000-8000-000000000001" },
        { "atMs": 750, "kind": "requestSwitch", "eventID": "30000000-0000-4000-8000-000000000001" },
        { "atMs": 751, "kind": "sendMessage", "type": "committed", "eventID": "30000000-0000-4000-8000-000000000001", "wakeSucceeded": false }
      ],
      "expectedHardwareCalls": { "wake": 0, "switchDisplay": 1, "usbActions": 0 },
      "finalState": {
        "coordinationEnabled": true,
        "usbPresent": false,
        "peerReachable": true,
        "peerLastSeenAtMs": -1000,
        "incomingEventID": null,
        "outgoingEventID": null
      }
    },
    {
      "id": "SM-004",
      "description": "Matching ready acknowledgement completes the current outgoing event and cancels remaining retries",
      "initialState": {
        "localPlatform": "mac",
        "coordinationEnabled": true,
        "usbAutomationEnabled": true,
        "usbPresent": true,
        "peerReachable": true,
        "peerLastSeenAtMs": -1000,
        "incomingEventID": null,
        "outgoingEventID": null,
        "newestIncomingRequestTimestamp": null,
        "seenMessages": [],
        "nextEventIDs": ["40000000-0000-4000-8000-000000000001"]
      },
      "steps": [
        { "atMs": 0, "input": { "kind": "usbPresenceChanged", "present": false } },
        {
          "atMs": 375,
          "input": {
            "kind": "receiveMessage",
            "message": {
              "version": 1,
              "type": "usb_attached_and_awake",
              "eventID": "40000000-0000-4000-8000-000000000001",
              "source": "windows",
              "target": "mac",
              "timestamp": 1788000000.375,
              "pairingCode": "TEST-CODE-0001",
              "wakeSucceeded": true
            }
          }
        },
        { "atMs": 376, "input": { "kind": "switchCompleted", "eventID": "40000000-0000-4000-8000-000000000001", "success": true } },
        { "atMs": 800, "input": { "kind": "advanceTime" } }
      ],
      "expectedActions": [
        { "atMs": 150, "kind": "sendMessage", "type": "handover_request", "eventID": "40000000-0000-4000-8000-000000000001" },
        { "atMs": 300, "kind": "sendMessage", "type": "handover_request", "eventID": "40000000-0000-4000-8000-000000000001" },
        { "atMs": 375, "kind": "acceptMessage", "type": "usb_attached_and_awake", "eventID": "40000000-0000-4000-8000-000000000001" },
        { "atMs": 375, "kind": "setPeerReachable", "value": true },
        { "atMs": 375, "kind": "requestSwitch", "eventID": "40000000-0000-4000-8000-000000000001" },
        { "atMs": 376, "kind": "sendMessage", "type": "committed", "eventID": "40000000-0000-4000-8000-000000000001", "wakeSucceeded": true }
      ],
      "expectedHardwareCalls": { "wake": 0, "switchDisplay": 1, "usbActions": 0 },
      "finalState": {
        "coordinationEnabled": true,
        "usbPresent": false,
        "peerReachable": true,
        "peerLastSeenAtMs": 375,
        "incomingEventID": null,
        "outgoingEventID": null
      }
    },
    {
      "id": "SM-005",
      "description": "USB return before debounce prevents handover request and display switch",
      "initialState": {
        "localPlatform": "windows",
        "coordinationEnabled": true,
        "usbAutomationEnabled": true,
        "usbPresent": true,
        "peerReachable": true,
        "peerLastSeenAtMs": -1000,
        "incomingEventID": null,
        "outgoingEventID": null,
        "newestIncomingRequestTimestamp": null,
        "seenMessages": [],
        "nextEventIDs": ["50000000-0000-4000-8000-000000000001"]
      },
      "steps": [
        { "atMs": 0, "input": { "kind": "usbPresenceChanged", "present": false } },
        { "atMs": 100, "input": { "kind": "usbPresenceChanged", "present": true } },
        { "atMs": 101, "input": { "kind": "wakeCompleted", "eventID": "50000000-0000-4000-8000-000000000001", "success": true } },
        { "atMs": 800, "input": { "kind": "advanceTime" } }
      ],
      "expectedActions": [
        { "atMs": 100, "kind": "requestWake", "eventID": "50000000-0000-4000-8000-000000000001" },
        { "atMs": 101, "kind": "sendBurst", "type": "usb_present", "eventID": "50000000-0000-4000-8000-000000000001", "count": 3, "wakeSucceeded": true }
      ],
      "expectedHardwareCalls": { "wake": 1, "switchDisplay": 0, "usbActions": 0 },
      "finalState": {
        "coordinationEnabled": true,
        "usbPresent": true,
        "peerReachable": true,
        "peerLastSeenAtMs": -1000,
        "incomingEventID": null,
        "outgoingEventID": null
      }
    },
    {
      "id": "SM-006",
      "description": "USB return while waiting cancels the outgoing event and prevents fallback switch",
      "initialState": {
        "localPlatform": "mac",
        "coordinationEnabled": true,
        "usbAutomationEnabled": true,
        "usbPresent": true,
        "peerReachable": true,
        "peerLastSeenAtMs": -1000,
        "incomingEventID": null,
        "outgoingEventID": null,
        "newestIncomingRequestTimestamp": null,
        "seenMessages": [],
        "nextEventIDs": [
          "60000000-0000-4000-8000-000000000001",
          "60000000-0000-4000-8000-000000000002"
        ]
      },
      "steps": [